"pathway"	"pval"	"padj"	"log2err"	"ES"	"NES"	"size"	"gene_symbols"
"REACTOME_INTERLEUKIN_27_SIGNALING"	0.808510638297872	0.945325578096184	0.0583452776743612	-0.392176529588766	-0.714900148874742	3	"Il6st, Canx, Stat1"
"REACTOME_INTERLEUKIN_2_FAMILY_SIGNALING"	0.626398210290828	0.836553454003118	0.0732558655828455	-0.392964824120603	-0.845352536198741	5	"Stat5b, Stat5a, Ptpn6, Pik3cd, Stat1"
"REACTOME_INTERLEUKIN_35_SIGNALLING"	0.808510638297872	0.945325578096184	0.0583452776743612	-0.392176529588766	-0.714900148874742	3	"Il6st, Canx, Stat1"
"REACTOME_INTERLEUKIN_37_SIGNALING"	0.672932330827068	0.86626305623122	0.0611692626746689	0.510531594784353	0.865931693472575	3	"Il18bp, Casp1, Ptpn6"
"REACTOME_INTERLEUKIN_3_INTERLEUKIN_5_AND_GM_CSF_SIGNALING"	0.0487256362960333	0.29551409577668	0.321775918075361	0.737422911978881	1.54168337153589	6	"Blnk, Rapgef1, Pik3cd, Ptpn6"
"REACTOME_INTERLEUKIN_4_AND_INTERLEUKIN_13_SIGNALING"	0.194827586206897	0.594948118645844	0.128142916898415	0.547359374390925	1.29807926177245	10	"F13a1, Ccnd1, Cdkn1a, Tnf, Nos2, Hsp90aa1"
"REACTOME_INTERLEUKIN_7_SIGNALING"	0.150337837837838	0.539293290383407	0.14641623786055	0.588193442791939	1.33534549785992	8	"H3c8, H3c3, H3c1, H3c7, H3c6"
"REACTOME_INTERLEUKIN_9_SIGNALING"	0.808510638297872	0.945325578096184	0.0583452776743612	-0.392176529588766	-0.714900148874742	3	"Stat5b, Stat5a, Stat1"
"REACTOME_INTRACELLULAR_SIGNALING_BY_SECOND_MESSENGERS"	0.545595054095827	0.782176691278502	0.0618406035753285	0.335471598045885	0.933750184564419	19	"Pik3ap1, Cdkn1a, Tgfa, Kitl, Psmd2, Psmd14, Itpr3, Kpna2, Psmd11"
"REACTOME_INTRAFLAGELLAR_TRANSPORT"	0.24263431542461	0.619839263724156	0.11331290842208	0.596579476861167	1.24723092317314	6	"Tuba1c, Tubb6, Tuba1b, Tubb4b, Tubb2a, Tuba1a"
"REACTOME_INTRA_GOLGI_AND_RETROGRADE_GOLGI_TO_ER_TRAFFIC"	0.0299322439186476	0.239846681789683	0.352487857583619	0.574045306382903	1.6236457915302	20	"Kif18a, Kif11, Tuba1c, Tubb6, Kif15, Tuba1b, Kif23, Kif4, Kif2c, Racgap1, Tubb4b, Kif20b, Kif20a, Tubb2a, Snap29, Arf1, Tuba1a, Rab6a"
"REACTOME_INTRA_GOLGI_TRAFFIC"	0.516917293233083	0.768525228734487	0.0741758965588009	0.58876629889669	0.998628495222793	3	"Snap29, Arf1, Rab6a"
"REACTOME_INTRINSIC_PATHWAY_FOR_APOPTOSIS"	0.31063829787234	0.643167214051121	0.110564716336619	-0.637234200717046	-1.16161674804555	3	"Bmf, Bcl2l11"
"REACTOME_ION_CHANNEL_TRANSPORT"	0.404921700223714	0.695448971892096	0.0972150808846466	-0.490855689489371	-1.05593701152771	5	"Ttyh3, Atp8b1, Atp8b2"
"REACTOME_ION_HOMEOSTASIS"	0.923937360178971	0.99265416144528	0.0544555953940371	-0.273366834170854	-0.588071329529559	5	"Itpr1, Atp2b4, Slc8a1, Atp2b1, Itpr3"
"REACTOME_ION_TRANSPORT_BY_P_TYPE_ATPASES"	0.678879310344828	0.86722263868066	0.0673623868166279	-0.408513607602839	-0.812200992091569	4	"Atp8b1, Atp8b2, Atp2b4"
"REACTOME_IRE1ALPHA_ACTIVATES_CHAPERONES"	0.138297872340426	0.523495627202715	0.173747838999571	-0.72617853560682	-1.32375372835118	3	"Pdia5, Wipi1, Klhdc3"
"REACTOME_IRON_UPTAKE_AND_TRANSPORT"	0.738721804511278	0.909763180406105	0.0567672387487446	0.472999690677185	0.802272430040508	3	"Tfrc, Abcg2, Slc40a1"
"REACTOME_KINESINS"	0.0295116562587153	0.239846681789683	0.352487857583619	0.599414478060255	1.64297518456252	17	"Kif18a, Kif11, Tuba1c, Tubb6, Kif15, Tuba1b, Kif23, Kif4, Kif2c, Racgap1, Tubb4b, Kif20b, Kif20a, Tubb2a"
"REACTOME_L1CAM_INTERACTIONS"	0.869172932330827	0.977270927377841	0.0390355298112393	0.225469432849762	0.646464950900862	21	"Tuba1c, L1cam, Tubb6, Tuba1b, Kif4"
"REACTOME_LAGGING_STRAND_SYNTHESIS"	0.171171171171171	0.577118101708266	0.141225119642531	0.656815913923654	1.28953124426226	5	"Prim2, Pola1, Lig1, Rfc1"
"REACTOME_LAMININ_INTERACTIONS"	0.295774647887324	0.635876328752917	0.120433371642259	-0.525528966825706	-1.19321823274657	6	"Itgb4, Lamb1, Itga2, Col4a2, Col4a1"
"REACTOME_LATE_ENDOSOMAL_MICROAUTOPHAGY"	0.509398496240602	0.768491313234543	0.0749278818393739	0.591124770827937	1.00262878749519	3	"Chmp4c, Pcnt"
"REACTOME_LEISHMANIA_INFECTION"	0.993103448275862	0.99830220713073	0.0391956336118146	0.181818181818182	0.43118730083682	10	"Txn1, Itpr3, Actr3, Myo1c, Casp1, Plcg1, Elmo1, Vav2, Baiap2, Itpr1"
"REACTOME_LYSOSOME_VESICLE_BIOGENESIS"	0.933333333333333	0.994588370754174	0.0440640346597561	0.304522613065327	0.59787136061653	5	"Cltb, Ap1b1, Arf1, Ap4m1, Arrb1"
"REACTOME_MAP2K_AND_MAPK_ACTIVATION"	0.712765957446808	0.883085533623857	0.0643583367917361	-0.429287863590772	-0.782550546594346	3	"Arrb1, Mark3, Rap1b"
"REACTOME_MAPK6_MAPK4_SIGNALING"	0.509337860780985	0.768491313234543	0.0697792517076235	0.440456439941612	0.968080844039861	7	"Psmd2, Psmd14, Psmd11, Cdc42ep3, Psmc3, Xpo1"
"REACTOME_MAPK_FAMILY_SIGNALING_CASCADES"	0.956723338485317	0.99830220713073	0.0358449292332649	0.196820058216182	0.547828092619043	19	"Tgfa, Kitl, Psmd2, Psmd14, Psmd11, Cdc42ep3, Psmc3, Ppp2r5d, Xpo1, Rasgrp3, Rap1b"
"REACTOME_MATURATION_OF_SARS_COV_2_SPIKE_PROTEIN"	0.84051724137931	0.961424758091425	0.0571258510018113	-0.340361445783133	-0.676701825324606	4	"St3gal4, St6gal1, Canx, Rpn2"
"REACTOME_MEIOSIS"	0.009912941213019	0.130133717626228	0.380730400722792	0.652721454037175	1.72032116151825	15	"H3c8, H2bc11, H3c3, H3c1, Brca1, H2ac4, H4c14, H3c7, H4c4, H3c6, H2bc6"
"REACTOME_MEIOTIC_RECOMBINATION"	0.00576824716472015	0.110684165045593	0.407017918923954	0.687621158816008	1.7947073694231	14	"H3c8, H2bc11, H3c3, H3c1, Brca1, H2ac4, H4c14, H3c7, H4c4, H3c6, H2bc6"
"REACTOME_MEIOTIC_SYNAPSIS"	0.126929674099485	0.495668410882168	0.161978948883402	0.607144216174063	1.40058599252038	9	"H2bc11, Brca1, H2ac4, H4c14, H4c4, H2bc6, Lmnb1"
"REACTOME_MEMBRANE_TRAFFICKING"	0.510259917920657	0.768491313234543	0.059221919380382	0.289768422928679	0.972561939865343	44	"Chmp4c, Kif18a, Kif11, Tuba1c, Tgfa, Tubb6, Kif15, Tpd52, Tuba1b, Kif23, Kif4, Kif2c, Racgap1, Tubb4b, Cltb, Ap1b1, Kif20b, Tfrc"
"REACTOME_METABOLISM_OF_AMINO_ACIDS_AND_DERIVATIVES"	0.856259659969088	0.969380202203536	0.0409883873374721	0.241993136815813	0.673562642802869	19	"Ido1, Psat1, Asns, Rars, Psmd2, Psmd14, Psmd11, Sat1, Psmc3, Sqor, Mars1"
"REACTOME_METABOLISM_OF_CARBOHYDRATES"	0.603658536585366	0.829526318648487	0.0564118388217596	0.322248691858071	0.898088093160758	18	"Taldo1, G6pdx, Nup205, Pfkfb3, Hmmr, Pgk1, Manba"
"REACTOME_METABOLISM_OF_FAT_SOLUBLE_VITAMINS"	0.298872180451128	0.635876328752917	0.105125131597001	0.685912545196906	1.16340186954996	3	"Lpl, Akr1b8"
"REACTOME_METABOLISM_OF_LIPIDS"	0.915966386554622	0.992036176359754	0.0332359307785383	0.196226077029967	0.621017836575833	33	"Gpat3, Hsd17b12, Ch25h, Akr1b8, Tnfaip8"
"REACTOME_METABOLISM_OF_NUCLEOTIDES"	0.0710571923743501	0.36233295615681	0.222056046145248	0.695293418670801	1.45360590848283	6	"Rrm2, Xdh, Txn1, Rrm1, Dck"
"REACTOME_METABOLISM_OF_POLYAMINES"	0.190990990990991	0.594833249439046	0.132846300606183	0.644221105527638	1.26480376948909	5	"Psmd2, Psmd14, Psmd11, Sat1, Psmc3"
"REACTOME_METABOLISM_OF_RNA"	0.478195488721805	0.768491313234543	0.0668966276500666	0.345018994440693	0.993104797846315	22	"Nup205, Ran, Hspa1a, Snrnp40, Psmd2, Psmd14, Gtf2f1, Wdr43, Set, Psmd11, Ybx1, Upf3b, Psmc3, Xpo1, Polr2a"
"REACTOME_METABOLISM_OF_STEROIDS"	0.243103448275862	0.619839263724156	0.112843355675562	0.514967451733696	1.22126084042527	10	"Hsd17b12, Ch25h, Akr1b8, Ran, Osbpl1a, Lbr, Kpnb1"
"REACTOME_METABOLISM_OF_VITAMINS_AND_COFACTORS"	0.482758620689655	0.768491313234543	0.0732558655828455	0.417614928377325	0.990386395658995	10	"Lpl, Nudt12, Akr1b8"
"REACTOME_METABOLISM_OF_WATER_SOLUBLE_VITAMINS_AND_COFACTORS"	0.694835680751174	0.874925744945866	0.0704500850658419	-0.34031752770875	-0.772693999035056	6	"Slc19a1, Enpp2"
"REACTOME_METALLOPROTEASE_DUBS"	0.201127819548872	0.60240711000803	0.132147260608774	0.731193580742227	1.24020472405011	3	"Brca1, H2ac4, Psmd14"
"REACTOME_MET_PROMOTES_CELL_MOTILITY"	0.548098434004474	0.782176691278502	0.0802023444698144	-0.430150753768844	-0.925347533230335	5	"Lamb1, Itga2, Tns4, Rapgef1, Rap1b"
"REACTOME_MHC_CLASS_II_ANTIGEN_PRESENTATION"	0.0134093236017624	0.152690308873383	0.380730400722792	0.567902319073317	1.64936460555924	23	"H2-Eb1, Kif18a, Kif11, Tuba1c, Tubb6, Kif15, Tuba1b, Kif23, Kif4, Kif2c, Racgap1, Osbpl1a, Tubb4b, Ap1b1"
"REACTOME_MITOCHONDRIAL_BIOGENESIS"	0.635687732342007	0.838075493279954	0.0633597010643758	0.487554662020616	0.895993638700589	4	"Hspa9, Atp5g1, Atp5b"
"REACTOME_MITOCHONDRIAL_PROTEIN_IMPORT"	0.282882882882883	0.623352638352638	0.105920292736253	0.597989949748744	1.17403782035259	5	"Hspa9, Atp5g1, Ndufb8, Atp5b, Hspd1"
"REACTOME_MITOTIC_G1_PHASE_AND_G1_S_TRANSITION"	0.00164426939846276	0.0634071386782203	0.45505986738723	0.632613521819234	1.88149499596555	26	"Ccnd1, Rrm2, Cdkn1a, Prim2, Mcm5, Pola1, Mcm2, Mcm4, Ccna2, Mcm3, Ccnd2, Orc6, Mcm6, Cdk6, Pole, Top2a, Psmd2, Psmd14, Rbl1, Tfdp1, Psmd11, Pole4, Dbf4, Psmc3"
"REACTOME_MITOTIC_G2_G2_M_PHASES"	0.00876692355350332	0.122936178011626	0.380730400722792	0.5902777162912	1.71434970417043	23	"Cdkn1a, Tuba1c, Gtse1, Tpx2, Haus6, Tubb6, Foxm1, Tuba1b, Ccna2, Plk4, Hmmr, Tubb4b, Hsp90aa1, Psmd2, Psmd14, Psmd11, Tubb2a, Psmc3, Pcnt, Tubb5, Xpo1, Tuba1a"
"REACTOME_MITOTIC_METAPHASE_AND_ANAPHASE"	0.0117610062999865	0.143598064600391	0.380730400722792	0.54567089989127	1.70689301965288	32	"Chmp4c, Ercc6l, Nuf2, Kif18a, Tuba1c, Kntc1, Tubb6, Knl1, Tuba1b, Nup205, Kif2c, Mad2l1, Ran, Tubb4b, Rangap1, Psmd2, Psmd14, Lbr, Kpnb1, Psmd11, Lmnb1, Tmpo, Tubb2a, Psmc3, Ppp2r5d, Xpo1, Tuba1a"
"REACTOME_MITOTIC_PROMETAPHASE"	0.00660583415257572	0.110684165045593	0.407017918923954	0.574773328765162	1.74684833711516	28	"Ercc6l, Nuf2, Kif18a, Tuba1c, Kntc1, Haus6, Tubb6, Knl1, Tuba1b, Smc2, Plk4, Kif2c, Mad2l1, Ncaph, Tubb4b, Hsp90aa1, Rangap1"
"REACTOME_MITOTIC_PROPHASE"	0.00868043897925283	0.122936178011626	0.380730400722792	0.630668028111152	1.75763458811265	18	"H3c8, H2bc11, H3c3, H3c1, H2ac4, Ncapg2, H4c14, Smc2, Nup205, H3c7, H4c4, H3c6, H2bc6, Set, Lmnb1, Tmpo"
"REACTOME_MITOTIC_SPINDLE_CHECKPOINT"	0.0733652312599681	0.37103563678197	0.208955027549354	0.552222606505703	1.45544509065029	15	"Ercc6l, Nuf2, Kif18a, Kntc1, Knl1, Kif2c, Mad2l1, Rangap1"
"REACTOME_MOLECULES_ASSOCIATED_WITH_ELASTIC_FIBRES"	0.000647756460017263	0.0307435181408193	0.477270815362862	-0.778652291872684	-2.0668260639917	9	"Eln, Fbln5, Ltbp3, Fbln2, Ltbp4"
"REACTOME_MRNA_CAPPING"	0.982978723404255	0.99830220713073	0.0492917662312669	-0.283851554663992	-0.517434123098598	3	"Rnmt, Polr2a, Gtf2f1"
"REACTOME_MRNA_SPLICING"	0.511265164644714	0.768491313234543	0.070619624712259	0.459615778865149	0.960889595456739	6	"Snrnp40, Gtf2f1, Ybx1, Upf3b, Polr2a"
"REACTOME_MRNA_SPLICING_MINOR_PATHWAY"	0.395910780669145	0.692002695957117	0.0878312634480124	0.581325301204819	1.06831871884182	4	"Snrnp40, Gtf2f1, Ybx1, Polr2a"
"REACTOME_MUSCLE_CONTRACTION"	0.797136038186158	0.945325578096184	0.0645031249656493	-0.274470232088799	-0.728543709935853	9	"Scn1b, Itpr1, Atp2b4, Akap9, Slc8a1, Tpm4, Dmd, Atp2b1, Itpr3"
"REACTOME_M_PHASE"	8.11795435839239e-05	0.0050087778391281	0.538434096309916	0.572178918136272	2.03478257499842	56	"H3c8, Chmp4c, Ercc6l, Nuf2, H2bc11, Kif18a, H3c3, Tuba1c, Kntc1, H3c1, Haus6, H2ac4, Ncapg2, Tubb6, Knl1, H4c14, Tuba1b, Kif23, Smc2, Plk4, Nup205, Kif2c, Mad2l1, Ncaph, H3c7, Ran, H4c4, Tubb4b, H3c6, Hsp90aa1, Rangap1, Psmd2, H2bc6, Psmd14, Lbr, Set, Kpnb1, Psmd11, Lmnb1, Tmpo, Kif20a, Tubb2a, Psmc3, Pcnt, Tubb5"
"REACTOME_NCAM1_INTERACTIONS"	0.340540540540541	0.670786366971253	0.0946646223153342	0.570543838482693	1.12015267953795	5	"St8sia2, St8sia4, Prnp, Col4a1, Col4a2"
"REACTOME_NCAM_SIGNALING_FOR_NEURITE_OUT_GROWTH"	0.552364864864865	0.783469245107176	0.0655321029282414	0.407738520899551	0.925667915648413	8	"St8sia2, St8sia4, Prnp, Col4a1, Col4a2, Sptb, Sptbn5"
"REACTOME_NEDDYLATION"	0.346645367412141	0.670786366971253	0.086794975677172	0.426397683323615	1.11290796502467	14	"Ubd, Psmd2, Psmd14, Psmd11, Psmc3, Epas1, Dcaf7, Asb8"
"REACTOME_NEF_MEDIATED_DOWNREGULATION_OF_MHC_CLASS_I_COMPLEX_CELL_SURFACE_EXPRESSION"	0.526315789473684	0.769658206890295	0.0732558655828455	0.586760280842528	0.995226013126634	3	"H2-Q7, Ap1b1, B2m"
"REACTOME_NEF_MEDIATES_DOWN_MODULATION_OF_CELL_SURFACE_RECEPTORS_BY_RECRUITING_THEM_TO_CLATHRIN_ADAPTERS"	0.386617100371747	0.681550716941052	0.0891647117820678	0.587349397590361	1.0793893791407	4	"H2-Q7, Ap1b1, Arf1, B2m"
"REACTOME_NEGATIVE_EPIGENETIC_REGULATION_OF_RRNA_EXPRESSION"	0.00814518767330101	0.119656685581589	0.380730400722792	0.672624685890882	1.75556622298075	14	"H3c8, H2bc11, H3c3, H3c1, H2ac4, H4c14, Dnmt1, H3c7, H4c4, H3c6, H2bc6, Suv39h1"
"REACTOME_NEGATIVE_REGULATION_OF_NOTCH4_SIGNALING"	0.190990990990991	0.594833249439046	0.132846300606183	0.644221105527638	1.26480376948909	5	"Tacc3, Psmd2, Psmd14, Psmd11, Psmc3"
"REACTOME_NEGATIVE_REGULATION_OF_THE_PI3K_AKT_NETWORK"	0.0953206239168111	0.4381512090603	0.190023305279108	0.676071719522752	1.41342031963302	6	"Pik3ap1, Tgfa, Kitl"
"REACTOME_NERVOUS_SYSTEM_DEVELOPMENT"	0.815483870967742	0.947558471538788	0.0348652196832942	0.211322446020542	0.751556833181045	57	"Robo2, St8sia2, Tuba1c, L1cam, Tubb6, Tuba1b, Cxcl12, Kif4, Ntn1, Tubb4b, Hsp90aa1, Cltb, Psmd2, Cap1, Psmd14, Rhoc, Psmd11, Msn, Upf3b"
"REACTOME_NETRIN_1_SIGNALING"	0.764298093587522	0.929189361198271	0.0514264916187015	0.365191146881288	0.763481998502275	6	"Ntn1, Pitpna, Slit2, Robo1, Plcg1, Ablim1"
"REACTOME_NEURONAL_SYSTEM"	0.494590417310665	0.768491313234543	0.0665892104103933	0.354106245493442	0.985617781090636	19	"Slc1a1, Tuba1c, Tubb6, Tuba1b, Tubb4b, Epb41, Aldh2, Kpna2, Tubb2a, Tspan7, Tuba1a"
"REACTOME_NEUROTRANSMITTER_RECEPTORS_AND_POSTSYNAPTIC_SIGNAL_TRANSMISSION"	0.411764705882353	0.701819954501137	0.0802023444698144	0.429477433718013	1.04554358472289	11	"Tuba1c, Tubb6, Tuba1b, Tubb4b, Kpna2, Tubb2a, Tspan7, Tuba1a"
"REACTOME_NEUTROPHIL_DEGRANULATION"	0.043956043956044	0.29460969829873	0.252961123069611	0.459210262071101	1.49971727493141	38	"Dock2, Bin2, Svip, H2-Q7, Plau, Plaur, Pa2g4, Manba, Hspa1a, Tubb4b, Hsp90aa1, Psmd2, Cap1, Enpp4, Psmd14, Degs1, Kpnb1, Psmd11, Cd36, Tmem30a, Psmc3, S100a11, Snap29, Tubb5, Ctsb, Vcp, Rab6a, B2m, Pkm, Rap1b"
"REACTOME_NITRIC_OXIDE_STIMULATES_GUANYLATE_CYCLASE"	0.685106382978723	0.870546737213404	0.0662842187012672	-0.451260531586517	-0.822604610099383	3	"Pde9a, Itpr1"
"REACTOME_NONHOMOLOGOUS_END_JOINING_NHEJ"	0.179310344827586	0.588481291269259	0.134273452883202	0.553610063103159	1.31290295854054	10	"H2bc11, Brca1, H4c14, H4c4, Rnf168, H2bc6, Rif1"
"REACTOME_NONSENSE_MEDIATED_DECAY_NMD"	0.498881431767338	0.768491313234543	0.0852884689790502	-0.456599782879226	-0.982245129315407	5	"Rpl23, Rpl31, Rps27, Rps7"
"REACTOME_NON_INTEGRIN_MEMBRANE_ECM_INTERACTIONS"	0.257756563245823	0.619839263724156	0.131457611642763	-0.445997708189577	-1.18383994677499	9	"Thbs1, Itgb4, Lamb1, Itga2, Col4a2, Col4a1"
"REACTOME_NOTCH1_INTRACELLULAR_DOMAIN_REGULATES_TRANSCRIPTION"	0.704225352112676	0.882905207315371	0.0697792517076235	-0.337036014414034	-0.765243293666889	6	"Mamld1, Hif1a, Tle3"
"REACTOME_NOTCH3_ACTIVATION_AND_TRANSMISSION_OF_SIGNAL_TO_THE_NUCLEUS"	0.496240601503759	0.768491313234543	0.0762797180809272	0.597220240548914	1.01296754120196	3	"Tacc3, Ybx1"
"REACTOME_NOTCH3_INTRACELLULAR_DOMAIN_REGULATES_TRANSCRIPTION"	0.513157894736842	0.768491313234543	0.0745500777420554	0.590425344743884	1.001442464808	3	"Dlgap5, Stat1"
"REACTOME_NOTCH_HLH_TRANSCRIPTION_PATHWAY"	0.9182156133829	0.992187449137038	0.0462302524077616	0.328052690469213	0.60287214278878	4	"Hdac9, Ncor2, Tbl1xr1"
"REACTOME_NR1H2_AND_NR1H3_MEDIATED_SIGNALING"	0.247844827586207	0.619839263724156	0.126875729929857	-0.633534136546185	-1.25958363356881	4	"Abca1, Scd2, Tbl1xr1, Ncor2"
"REACTOME_NR1H3_NR1H2_REGULATE_GENE_EXPRESSION_LINKED_TO_CHOLESTEROL_TRANSPORT_AND_EFFLUX"	0.317021276595745	0.645746736835846	0.109250039480711	-0.632898696088265	-1.15371353948839	3	"Abca1, Tbl1xr1, Ncor2"
"REACTOME_NRAGE_SIGNALS_DEATH_THROUGH_JNK"	0.531400966183575	0.769658206890295	0.0860347242455604	-0.39047380079918	-0.929338859601268	7	"Bcl2l11, Vav2, Arhgef5, Prex1, Mcf2l"
"REACTOME_NS1_MEDIATED_EFFECTS_ON_HOST_PATHWAYS"	0.298872180451128	0.635876328752917	0.105125131597001	0.688064192577733	1.16705135898268	3	"Nup205, Kpna2, Kpnb1"
"REACTOME_NUCLEAR_ENVELOPE_BREAKDOWN"	0.353383458646617	0.670884904569115	0.0949751525905595	0.655967903711133	1.11261164544413	3	"Nup205, Lmnb1, Tmpo"
"REACTOME_NUCLEAR_ENVELOPE_NE_REASSEMBLY"	0.0271393495376914	0.23367722151847	0.352487857583619	0.619087028012954	1.61583167888875	14	"Chmp4c, Tuba1c, Tubb6, Tuba1b, Nup205, Ran, Tubb4b, Rangap1, Lbr, Kpnb1, Lmnb1, Tmpo, Tubb2a"
"REACTOME_NUCLEAR_IMPORT_OF_REV_PROTEIN"	0.298872180451128	0.635876328752917	0.105125131597001	0.688064192577733	1.16705135898268	3	"Nup205, Ran, Kpnb1"
"REACTOME_NUCLEAR_RECEPTOR_TRANSCRIPTION_PATHWAY"	0.794594594594595	0.944633650992032	0.0514264916187015	0.37604345378398	0.738288723788593	5	"Ar, Hnf4a, Nr5a2, Ncor2, Rara"
"REACTOME_NUCLEAR_SIGNALING_BY_ERBB4"	0.629699248120301	0.836925021332775	0.0643583367917361	0.534815900613977	0.907121211000349	3	"Cxcl12, Stmn1"
"REACTOME_NUCLEOTIDE_BINDING_DOMAIN_LEUCINE_RICH_REPEAT_CONTAINING_RECEPTOR_NLR_SIGNALING_PATHWAYS"	0.50187969924812	0.768491313234543	0.0756946307932749	0.593175354037502	1.00610685821482	3	"Txn1, Casp1, Panx1"
"REACTOME_NUCLEOTIDE_EXCISION_REPAIR"	0.295415959252971	0.635876328752917	0.0995791200495904	0.537014933884022	1.18030711623917	7	"Lig1, Pole, Rfc1, Pole4, Pcna, Polr2a"
"REACTOME_N_GLYCAN_ANTENNAE_ELONGATION"	0.434944237918216	0.729240746727008	0.0826646449123753	0.567593673929927	1.04308370081057	4	"St8sia2, St8sia6"
"REACTOME_N_GLYCAN_ANTENNAE_ELONGATION_IN_THE_MEDIAL_TRANS_GOLGI"	0.434944237918216	0.729240746727008	0.0826646449123753	0.567593673929927	1.04308370081057	4	"St8sia2, St8sia6"
"REACTOME_N_GLYCAN_TRIMMING_IN_THE_ER_AND_CALNEXIN_CALRETICULIN_CYCLE"	0.825531914893617	0.955634505608559	0.0573667426768556	-0.384152457372116	-0.700273035854287	3	"Uggt2, Canx, Vcp"
"REACTOME_ONCOGENIC_MAPK_SIGNALING"	0.485915492957746	0.768491313234543	0.0894366833718621	-0.430583501006036	-0.977643701019148	6	"Bcl2l11, Arrb1, Mark3, Akap9, Qk, Rap1b"
"REACTOME_OPIOID_SIGNALLING"	0.913145539906103	0.992036176359754	0.0572461135202884	-0.27364185110664	-0.621306277283197	6	"Itpr1, Pde4d, Pde4b, Ppp2r5d, Kpna2, Itpr3"
"REACTOME_ORC1_REMOVAL_FROM_CHROMATIN"	0.0420168067226891	0.29460969829873	0.287857117255149	0.648129423660263	1.57784206520863	11	"Mcm5, Mcm2, Mcm4, Ccna2, Mcm3, Orc6, Mcm6, Psmd2, Psmd14, Psmd11, Psmc3"
"REACTOME_ORGANELLE_BIOGENESIS_AND_MAINTENANCE"	0.507598784194529	0.768491313234543	0.0645031249656493	0.342105436422224	0.967620579648186	20	"Tuba1c, Haus6, Tubb6, Tuba1b, Plk4, Hspa9, Atp5g1, Tubb4b, Hsp90aa1, Tubb2a, Atp5b, Pcnt, Tubb5, Tuba1a, Exoc4"
"REACTOME_OTHER_INTERLEUKIN_SIGNALING"	0.0466299152854866	0.29460969829873	0.321775918075361	0.858064273395125	1.45539484129911	3	"Csf3r, Csf1"
"REACTOME_OXIDATIVE_STRESS_INDUCED_SENESCENCE"	0.0121527655495543	0.144197237386058	0.380730400722792	0.648203146124662	1.74195139479446	16	"H3c8, H2bc11, H3c3, H3c1, H2ac4, H4c14, Txn1, H3c7, H4c4, Cdk6, H3c6, H2bc6"
"REACTOME_O_GLYCOSYLATION_OF_TSR_DOMAIN_CONTAINING_PROTEINS"	2.10990893839317e-06	0.000216968969164765	0.627256739718528	-0.900243611026791	-2.24946898657786	8	"Adamts17, Adamts18, Adamts2, Adamts12, Thbs1, Adamts10, Thsd7a"
"REACTOME_O_LINKED_GLYCOSYLATION"	5.76704912983943e-06	0.000508324187587276	0.610526878385931	-0.808082547401334	-2.31877021095872	12	"Adamts17, Adamts18, Adamts2, Adamts12, Thbs1, Adamts10, Thsd7a, St3gal4"
"REACTOME_O_LINKED_GLYCOSYLATION_OF_MUCINS"	0.163829787234043	0.574335106382979	0.158514105424824	-0.716148445336008	-1.30546983707562	3	"St3gal4, St6gal1, Galnt10"
"REACTOME_P75_NTR_RECEPTOR_MEDIATED_SIGNALLING"	0.9739336492891	0.99830220713073	0.0546808488785442	-0.198434957824617	-0.54717391922715	10	"Bcl2l11, Vav2, Arhgef5, Prex1, Mcf2l"
"REACTOME_PARASITE_INFECTION"	0.588366890380313	0.819463592245267	0.0764767053228531	-0.412060301507538	-0.886431048187938	5	"Baiap2, Vav2, Elmo1, Myo1c, Actr3"
"REACTOME_PCNA_DEPENDENT_LONG_PATCH_BASE_EXCISION_REPAIR"	0.264864864864865	0.619839263724156	0.110122263835536	0.605025125628141	1.1878500300038	5	"Lig1, Pole, Rfc1, Pole4, Pcna"
"REACTOME_PCP_CE_PATHWAY"	0.369150779896014	0.677907621135822	0.0878312634480124	0.519006968081592	1.08505499273877	6	"Cltb, Psmd2, Psmd14, Psmd11, Psmc3"
"REACTOME_PD_1_SIGNALING"	0.00698710385059033	0.110684165045593	0.407017918923954	0.90290054799818	1.65928707159288	4	"H2-Eb1, Cd274"
"REACTOME_PEPTIDE_HORMONE_METABOLISM"	0.178970917225951	0.588481291269259	0.155241966228839	-0.616641586112789	-1.32652974706478	5	"Inhbb, Igf1"
"REACTOME_PEPTIDE_LIGAND_BINDING_RECEPTORS"	0.104501607717042	0.447912885662432	0.173747838999571	0.552104497937317	1.40796222757891	13	"Pf4, Apln, Cxcl10, Ccrl2, Cxcl12"
"REACTOME_PHASE_II_CONJUGATION_OF_COMPOUNDS"	0.37360594795539	0.677907621135822	0.0911073131586733	0.594651606517045	1.09280886470085	4	"Gstm1, Esd"
"REACTOME_PHASE_I_FUNCTIONALIZATION_OF_COMPOUNDS"	0.341379310344828	0.670786366971253	0.0919686140000427	0.468198053886258	1.11034580311747	10	"Ephx1, Fmo1, Adh1"
"REACTOME_PHOSPHOLIPID_METABOLISM"	0.685714285714286	0.870546737213404	0.0550211117163117	0.335935878007799	0.817820855192872	11	"Gpat3, Tnfaip8"
"REACTOME_PI3K_AKT_SIGNALING_IN_CANCER"	0.0560271646859083	0.311430275776626	0.248911114434702	0.694894755695234	1.52731176254681	7	"Pik3ap1, Cdkn1a, Tgfa, Kitl"
"REACTOME_PI_METABOLISM"	0.426829268292683	0.721516872702974	0.0992333343771191	-0.406996759572978	-1.01697649067776	8	"Pik3cg, Enpp6, Inpp5e, Synj2, Inpp4b"
"REACTOME_PKMTS_METHYLATE_HISTONE_LYSINES"	0.100826446280992	0.447553362268863	0.179782316298324	0.569370272251191	1.42956865312867	12	"H3c8, H3c3, H3c1, H4c14, H3c7, H4c4, H3c6, Suv39h1"
"REACTOME_PLASMA_LIPOPROTEIN_ASSEMBLY_REMODELING_AND_CLEARANCE"	0.492170022371365	0.768491313234543	0.0860347242455604	-0.462450441856291	-0.994831165268533	5	"Pcsk6, Bmp1, Abca1"
"REACTOME_PLATELET_ACTIVATION_SIGNALING_AND_AGGREGATION"	0.314037626628075	0.643724968868845	0.086794975677172	0.372848750701031	1.14137810330999	29	"Pf4, F13a1"
"REACTOME_PLATELET_CALCIUM_HOMEOSTASIS"	0.923937360178971	0.99265416144528	0.0544555953940371	-0.273366834170854	-0.588071329529559	5	"Itpr1, Atp2b4, Slc8a1, Atp2b1, Itpr3"
"REACTOME_PLATELET_HOMEOSTASIS"	0.916467780429594	0.992036176359754	0.0578529757032509	-0.226034308779011	-0.59997717288835	9	"Pde9a, Itpr1, Atp2b4, Slc8a1, Ptpn6, Ppp2r5d, Atp2b1, Itpr3, Nos2"
"REACTOME_POLYMERASE_SWITCHING"	0.239776951672862	0.619839263724156	0.118815039412263	0.662034023344495	1.21663952727201	4	"Prim2, Pola1, Rfc1, Pcna"
"REACTOME_POLYMERASE_SWITCHING_ON_THE_C_STRAND_OF_THE_TELOMERE"	0.239776951672862	0.619839263724156	0.118815039412263	0.662034023344495	1.21663952727201	4	"Prim2, Pola1, Rfc1, Pcna"
"REACTOME_POSITIVE_EPIGENETIC_REGULATION_OF_RRNA_EXPRESSION"	0.0414673046251994	0.29460969829873	0.282013350011725	0.601510415219515	1.58534868093492	15	"H3c8, H2bc11, H3c3, H3c1, H2ac4, H4c14, H3c7, Dek, H4c4, H3c6, H2bc6"
"REACTOME_POSTMITOTIC_NUCLEAR_PORE_COMPLEX_NPC_REFORMATION"	0.195167286245353	0.594948118645844	0.133554954557592	0.688755020080321	1.26574549417183	4	"Nup205, Ran, Rangap1, Kpnb1"
"REACTOME_POST_CHAPERONIN_TUBULIN_FOLDING_PATHWAY"	0.24263431542461	0.619839263724156	0.11331290842208	0.596579476861167	1.24723092317314	6	"Tuba1c, Tubb6, Tuba1b, Tubb4b, Tubb2a, Tuba1a"
"REACTOME_POST_TRANSLATIONAL_MODIFICATION_SYNTHESIS_OF_GPI_ANCHORED_PROTEINS"	0.213921901528014	0.619670484707908	0.120433371642259	0.576564840152718	1.26723400201105	7	"Alpl, Ulbp1, Plaur, Art3"
"REACTOME_POST_TRANSLATIONAL_PROTEIN_MODIFICATION"	0.914285714285714	0.992036176359754	0.0251307059474849	0.18516326224779	0.716714471842779	103	"Ubd, St8sia2, Alpl, Clspn, H2bc11, Tuba1c, Brca1, Tgfa, Ar, H2ac4, Tubb6, H4c14, Ulbp1, Ttll7, St8sia6, Rad18, Tuba1b, Dnmt1, Ccna2, H2-Q7, Nup205, Plaur, Art3"
"REACTOME_POTASSIUM_CHANNELS"	0.495744680851064	0.768491313234543	0.0828962134571565	-0.54062186559679	-0.98550173975316	3	"Gabbr1, Kcnc2, Kcnh6"
"REACTOME_POTENTIAL_THERAPEUTICS_FOR_SARS"	0.693617021276596	0.874925744945866	0.0656813601934011	-0.44163689658234	-0.805061647738996	3	"Chd3"
"REACTOME_PRC2_METHYLATES_HISTONES_AND_DNA"	0.00431680806846859	0.110684165045593	0.407017918923954	0.698546891252482	1.78141572972266	13	"H3c8, H2bc11, H3c3, H3c1, H2ac4, H4c14, Dnmt1, H3c7, H4c4, H3c6, H2bc6"
"REACTOME_PRE_NOTCH_EXPRESSION_AND_PROCESSING"	0.0975609756097561	0.439380452198683	0.175204047558551	0.510326087219453	1.4222486984151	18	"H3c8, Ccnd1, H2bc11, H3c3, H3c1, H2ac4, H4c14, H3c7, H4c4, H3c6, H2bc6"
"REACTOME_PRE_NOTCH_PROCESSING_IN_GOLGI"	0.202127659574468	0.602477130229212	0.141225119642531	-0.692408158978231	-1.26219357505835	3	"Lfng, St3gal4"
"REACTOME_PROCESSING_OF_CAPPED_INTRON_CONTAINING_PRE_MRNA"	0.392190152801358	0.687446943972835	0.0833634065110386	0.487100436542562	1.07059985728173	7	"Nup205, Snrnp40, Gtf2f1, Ybx1, Upf3b, Polr2a"
"REACTOME_PROCESSING_OF_DNA_DOUBLE_STRAND_BREAK_ENDS"	0.0371444023071955	0.282939459549872	0.321775918075361	0.659687406079894	1.60597945595945	11	"Clspn, H2bc11, Brca1, H4c14, Ccna2, H4c4, Rnf168, H2bc6, Chek1"
"REACTOME_PROCESSIVE_SYNTHESIS_ON_THE_LAGGING_STRAND"	0.0892193308550186	0.423448670288819	0.204294756516886	0.763847593303386	1.40374533944596	4	"Prim2, Pola1, Lig1"
"REACTOME_PROGRAMMED_CELL_DEATH"	0.369924812030075	0.677907621135822	0.0799858801499946	0.374567764172788	1.07815815857206	22	"Chmp4c, H1f1, Clspn, Fas, H1f3, Hsp90aa1, Hmgb2, Psmd2, Psmd14, Tfdp1, Kpnb1, Psmd11, Lmnb1"
"REACTOME_PROTEIN_FOLDING"	0.222410865874363	0.619839263724156	0.11776578836269	0.572004028197382	1.25720977648761	7	"Tuba1c, Tubb6, Tuba1b, Tubb4b, Tubb2a, Tuba1a, Dcaf7"
"REACTOME_PROTEIN_LOCALIZATION"	0.3446519524618	0.670786366971253	0.0905428948469474	0.507627646740559	1.11571668875976	7	"Hspa9, Atp5g1, Nos2, Ndufb8, Atp5b, Hspd1"
