"pathway"	"pval"	"padj"	"log2err"	"ES"	"NES"	"size"	"gene_symbols"
"REACTOME_ABC_FAMILY_PROTEINS_MEDIATED_TRANSPORT"	0.746621621621622	0.917660439323786	0.0513223330421143	0.325365364991905	0.738660351667974	8	"Psmd2, Psmd14, Psmd11, Psmc3, Vcp, Eif2s2, Abcb4"
"REACTOME_ABC_TRANSPORTER_DISORDERS"	0.714770797962649	0.883794754194297	0.0535669384770951	0.35638794724531	0.783306391934259	7	"Psmd2, Psmd14, Psmd11, Psmc3, Vcp, Abcb4"
"REACTOME_ABERRANT_REGULATION_OF_MITOTIC_G1_S_TRANSITION_IN_CANCER_DUE_TO_RB1_DEFECTS"	0.10990990990991	0.461322547036833	0.179782316298324	0.691457286432161	1.35754289143291	5	"Ccnd1, Cdkn1a, Ccnd2, Cdk6, Tfdp1"
"REACTOME_ACTIVATED_PKN1_STIMULATES_TRANSCRIPTION_OF_AR_ANDROGEN_RECEPTOR_REGULATED_GENES_KLK2_AND_KLK3"	0.00790737626154902	0.11899636959453	0.380730400722792	0.673772192060783	1.75856124102692	14	"H3c8, H2bc11, H3c3, H3c1, Ar, H2ac4, H4c14, H3c7, H4c4, H3c6, H2bc6"
"REACTOME_ACTIVATION_OF_AMPK_DOWNSTREAM_OF_NMDARS"	0.24263431542461	0.619839263724156	0.11331290842208	0.596579476861167	1.24723092317314	6	"Tuba1c, Tubb6, Tuba1b, Tubb4b, Tubb2a, Tuba1a"
"REACTOME_ACTIVATION_OF_ANTERIOR_HOX_GENES_IN_HINDBRAIN_DEVELOPMENT_DURING_EARLY_EMBRYOGENESIS"	0.102523659305994	0.447912885662432	0.173747838999571	0.531336251607934	1.42788866442079	16	"H3c8, H2bc11, H3c3, H3c1, H2ac4, H4c14, H3c7, H4c4, H3c6, H2bc6"
"REACTOME_ACTIVATION_OF_ATR_IN_RESPONSE_TO_REPLICATION_STRESS"	0.0600343053173242	0.326603145795523	0.241339976815091	0.668012108980828	1.54099862561207	9	"Clspn, Mcm5, Mcm2, Mcm4, Mcm3, Orc6, Mcm6, Chek1, Dbf4"
"REACTOME_ACTIVATION_OF_BH3_ONLY_PROTEINS"	0.31063829787234	0.643167214051121	0.110564716336619	-0.637234200717046	-1.16161674804555	3	"Bmf, Bcl2l11"
"REACTOME_ACTIVATION_OF_GENE_EXPRESSION_BY_SREBF_SREBP"	0.272340425531915	0.619839263724156	0.119348440591015	-0.66098294884654	-1.20490843505999	3	"Scd2, Acacb, Tbl1xr1"
"REACTOME_ACTIVATION_OF_NMDA_RECEPTORS_AND_POSTSYNAPTIC_EVENTS"	0.375	0.677907621135822	0.0855356947987884	0.484045775121367	1.09890437319117	8	"Tuba1c, Tubb6, Tuba1b, Tubb4b, Kpna2, Tubb2a, Tuba1a"
"REACTOME_ACTIVATION_OF_THE_MRNA_UPON_BINDING_OF_THE_CAP_BINDING_COMPLEX_AND_EIFS_AND_SUBSEQUENT_BINDING_TO_43S"	0.71063829787234	0.883085533623857	0.0645031249656493	-0.431293881644935	-0.78620732484946	3	"Rps27, Rps7, Eif2s2"
"REACTOME_ACTIVATION_OF_THE_PRE_REPLICATIVE_COMPLEX"	0.0275843741223063	0.23367722151847	0.352487857583619	0.672305680910141	1.68801775152294	12	"Prim2, Mcm5, Pola1, Mcm2, Mcm4, Mcm3, Orc6, Mcm6, Pole, Pole4, Dbf4"
"REACTOME_ADAPTIVE_IMMUNE_SYSTEM"	0.0148472641719835	0.160715122703751	0.380730400722792	0.433395463918876	1.58826332309154	67	"Fyb, Blnk, H2-Eb1, Pik3ap1, Xdh, Kif18a, Cd274, Kif11, Tuba1c, Tubb6, Kif15, Ulbp1, Tuba1b, Kif23, Kif4, H2-Q7, Kif2c, Racgap1, Btnl9, Hecw2, Sh3rf1, Osbpl1a, Tubb4b, Psmd2, Psmd14, Itpr3, Ap1b1, Tapbp, Tap1, Psmd11, Cd36, Cd81, Kif20a, Tubb2a, Ube2l3, Psmc3"
"REACTOME_AGGREPHAGY"	0.145797598627787	0.535043868598245	0.150169802128406	0.598385469223007	1.38038094409057	9	"Tuba1c, Tubb6, Tuba1b, Tubb4b, Hsp90aa1, Tubb2a, Pcnt, Vcp, Tuba1a"
"REACTOME_AMYLOID_FIBER_FORMATION"	0.0972886762360447	0.439380452198683	0.179782316298324	0.536643907879586	1.41438566974469	15	"H3c8, H2bc11, H3c3, H3c1, H2ac4, H4c14, H3c7, H4c4, H3c6, H2bc6"
"REACTOME_ANCHORING_FIBRIL_FORMATION"	0.259574468085106	0.619839263724156	0.122679189568808	-0.670010030090271	-1.221363937208	3	"Bmp1, Col4a2, Col4a1"
"REACTOME_ANCHORING_OF_THE_BASAL_BODY_TO_THE_PLASMA_MEMBRANE"	0.521440823327616	0.769658206890295	0.069119845655101	0.413085760151357	0.952923727122777	9	"Haus6, Plk4, Tubb4b, Hsp90aa1, Pcnt, Tubb5, Tuba1a"
"REACTOME_ANTIGEN_ACTIVATES_B_CELL_RECEPTOR_BCR_LEADING_TO_GENERATION_OF_SECOND_MESSENGERS"	0.00606554315404765	0.110684165045593	0.407017918923954	0.821472322228548	1.71740014960777	6	"Blnk, Pik3ap1, Itpr3"
"REACTOME_ANTIGEN_PRESENTATION_FOLDING_ASSEMBLY_AND_PEPTIDE_LOADING_OF_CLASS_I_MHC"	0.376576576576577	0.677907621135822	0.0888945288620449	0.55678391959799	1.09313773525267	5	"H2-Q7, Tapbp, Tap1, B2m, Canx"
"REACTOME_ANTIGEN_PROCESSING_CROSS_PRESENTATION"	0.143103448275862	0.531896551724138	0.152144922367565	0.582155054468136	1.38059826632545	10	"H2-Q7, Psmd2, Psmd14, Tapbp, Tap1, Psmd11, Cd36, Psmc3, B2m"
"REACTOME_ANTIGEN_PROCESSING_UBIQUITINATION_PROTEASOME_DEGRADATION"	0.864161849710983	0.974749289344929	0.0699458736501659	-0.217922606924644	-0.706040172943931	18	"Klhl22, Ube2h, Spsb1, Anapc7, Nedd4, Cblb, Fbxo30, Fbxo11, Det1, Cdc20, Asb8, Psmc3, Ube2l3, Psmd11, Psmd14, Psmd2, Sh3rf1, Hecw2"
"REACTOME_ANTIVIRAL_MECHANISM_BY_IFN_STIMULATED_GENES"	0.623310810810811	0.836553454003118	0.0597317976364411	0.376507865973798	0.854766556645891	8	"Nup205, Oas2, Kpna2, Kpnb1, Stat1, Oas1g"
"REACTOME_ANTI_INFLAMMATORY_RESPONSE_FAVOURING_LEISHMANIA_PARASITE_INFECTION"	0.995744680851064	0.99830220713073	0.048701086452153	-0.272818455366098	-0.497321842695472	3	"Itpr1, Plcg1, Itpr3"
"REACTOME_APC_CDC20_MEDIATED_DEGRADATION_OF_NEK2A"	0.984962406015038	0.99830220713073	0.0435378240914002	0.290416066875081	0.492585530787782	3	"Mad2l1, Cdc20"
"REACTOME_APC_C_CDH1_MEDIATED_DEGRADATION_OF_CDC20_AND_OTHER_APC_C_CDH1_TARGETED_PROTEINS_IN_LATE_MITOSIS_EARLY_G1"	0.674176776429809	0.86626305623122	0.0572461135202884	0.397824109438975	0.831705666253707	6	"Psmd2, Psmd14, Psmd11, Psmc3, Cdc20"
"REACTOME_APC_C_MEDIATED_DEGRADATION_OF_CELL_CYCLE_PROTEINS"	0.400337837837838	0.695448971892096	0.0819778796501272	0.472602129484421	1.07292444963428	8	"Ccna2, Mad2l1, Psmd2, Psmd14, Psmd11, Psmc3, Cdc20"
"REACTOME_APOPTOSIS"	0.516228748068006	0.768525228734487	0.0645031249656493	0.353087113445014	0.967800055908314	17	"H1f1, Clspn, Fas, H1f3, Hmgb2, Psmd2, Psmd14, Tfdp1, Kpnb1, Psmd11, Lmnb1, Psmc3"
"REACTOME_APOPTOSIS_INDUCED_DNA_FRAGMENTATION"	0.405405405405405	0.695448971892096	0.0847985102819124	0.545188186941231	1.07037175281525	5	"H1f1, H1f3, Hmgb2, Kpnb1"
"REACTOME_APOPTOTIC_EXECUTION_PHASE"	0.191850594227504	0.594833249439046	0.128142916898415	0.585063451817346	1.28591313213014	7	"H1f1, Clspn, H1f3, Hmgb2, Kpnb1, Lmnb1"
"REACTOME_ARACHIDONIC_ACID_METABOLISM"	0.834042553191489	0.960781480767996	0.0568864160475701	-0.3819372782984	-0.696234977148315	3	"Ptgs1"
"REACTOME_ASPARAGINE_N_LINKED_GLYCOSYLATION"	0.413533834586466	0.70289359763044	0.0741758965588009	0.365085803874924	1.04677238636543	21	"St8sia2, Tuba1c, Tgfa, Tubb6, St8sia6, Tuba1b, Tubb4b, Rpn2, Nus1, Tubb2a, Vcp, Arf1, St8sia4, Tuba1a"
"REACTOME_ASSEMBLY_AND_CELL_SURFACE_PRESENTATION_OF_NMDA_RECEPTORS"	0.405772495755518	0.695448971892096	0.0815265143256594	0.480370970483289	1.05580913885459	7	"Tuba1c, Tubb6, Tuba1b, Tubb4b, Tubb2a, Tuba1a"
"REACTOME_ASSEMBLY_OF_COLLAGEN_FIBRILS_AND_OTHER_MULTIMERIC_STRUCTURES"	0.0902439024390244	0.42504189164029	0.234392647294686	-0.584095901677831	-1.45950007300014	8	"Col15a1, Itgb4, Bmp1"
"REACTOME_ASSEMBLY_OF_THE_PRE_REPLICATIVE_COMPLEX"	0.053781512605042	0.304432965846889	0.252961123069611	0.632644435956434	1.54014455590508	11	"Mcm5, Mcm2, Mcm4, Mcm3, Orc6, Mcm6, Psmd2, Psmd14, Psmd11, Psmc3"
"REACTOME_ASYMMETRIC_LOCALIZATION_OF_PCP_PROTEINS"	0.278810408921933	0.619839263724156	0.108820126769161	0.643574297188755	1.18271554193024	4	"Psmd2, Psmd14, Psmd11, Psmc3"
"REACTOME_ATTENUATION_PHASE"	0.633458646616541	0.836925021332775	0.0640703750499722	0.530089798300753	0.899105092465425	3	"Hspa1a, Hsp90aa1"
"REACTOME_AUF1_HNRNP_D0_BINDS_AND_DESTABILIZES_MRNA"	0.190990990990991	0.594833249439046	0.132846300606183	0.644221105527638	1.26480376948909	5	"Hspa1a, Psmd2, Psmd14, Psmd11, Psmc3"
"REACTOME_AURKA_ACTIVATION_BY_TPX2"	0.174137931034483	0.580773532152842	0.136490437780413	0.556651772827079	1.32011646487236	10	"Tpx2, Haus6, Plk4, Hmmr, Tubb4b, Hsp90aa1, Pcnt, Tubb5, Tuba1a"
"REACTOME_AUTOPHAGY"	0.263578274760383	0.619839263724156	0.102821842840815	0.454135894843068	1.18530534836624	14	"Chmp4c, Tuba1c, Tubb6, Tuba1b, Tubb4b, Hsp90aa1, Sqstm1, Tubb2a, Pcnt, Vcp, Tuba1a, Epas1"
"REACTOME_A_TETRASACCHARIDE_LINKER_SEQUENCE_IS_REQUIRED_FOR_GAG_SYNTHESIS"	0.346808510638298	0.670786366971253	0.103576326612592	-0.621852216299885	-1.13357686773617	3	"Gpc4, Xylt2"
"REACTOME_BASE_EXCISION_REPAIR"	0.0958677685950413	0.4381512090603	0.184706471207739	0.573540725552236	1.44003978167027	12	"H2bc11, H2ac4, H4c14, Lig1, H4c4, Pole, Rfc1, H2bc6, Pole4, Pcna, H2az1, H4c1"
"REACTOME_BASE_EXCISION_REPAIR_AP_SITE_FORMATION"	0.113752122241087	0.466982024597919	0.170932335370056	0.638088591736683	1.40245728395421	7	"H2bc11, H2ac4, H4c14, H4c4, H2bc6"
"REACTOME_BASIGIN_INTERACTIONS"	0.349624060150376	0.670884904569115	0.0956031492204301	0.656970912738215	1.11431288649221	3	"L1cam, Slc16a1, Itga6"
"REACTOME_BETA_CATENIN_INDEPENDENT_WNT_SIGNALING"	0.782758620689655	0.936979929436826	0.0500922874402106	0.30646251032521	0.726785084491418	10	"Cltb, Psmd2, Psmd14, Itpr3, Psmd11, Psmc3"
"REACTOME_BINDING_AND_UPTAKE_OF_LIGANDS_BY_SCAVENGER_RECEPTORS"	0.948545861297539	0.99830220713073	0.0532386494755899	-0.250251256281407	-0.538344709753162	5	"Apol8, Col4a2, Col4a1, Cd36, Hsp90aa1"
"REACTOME_BIOLOGICAL_OXIDATIONS"	0.180511182108626	0.589287827306997	0.128142916898415	0.49321596234967	1.28730524213394	14	"Gstm1, Ephx1, Fmo1, Adh1"
"REACTOME_BIOSYNTHESIS_OF_THE_N_GLYCAN_PRECURSOR_DOLICHOL_LIPID_LINKED_OLIGOSACCHARIDE_LLO_AND_TRANSFER_TO_A_NASCENT_PROTEIN"	0.616298811544992	0.835728278512659	0.0605092988656667	0.389745695612107	0.856623510872238	7	"St8sia2, St8sia6"
"REACTOME_BMAL1_CLOCK_NPAS2_ACTIVATES_CIRCADIAN_GENE_EXPRESSION"	0.272340425531915	0.619839263724156	0.119348440591015	-0.66098294884654	-1.20490843505999	3	"Npas2, Serpine1, Tbl1xr1"
"REACTOME_B_WICH_COMPLEX_POSITIVELY_REGULATES_RRNA_EXPRESSION"	0.00790737626154902	0.11899636959453	0.380730400722792	0.673768860379811	1.75855254526135	14	"H3c8, H2bc11, H3c3, H3c1, H2ac4, H4c14, H3c7, Dek, H4c4, H3c6, H2bc6"
"REACTOME_CA2_PATHWAY"	0.590604026845638	0.820478723404255	0.0762797180809272	-0.410559340247966	-0.883202155092088	5	"Itpr1, Fzd6, Tcf7l2, Nfatc1"
"REACTOME_CARBOXYTERMINAL_POST_TRANSLATIONAL_MODIFICATIONS_OF_TUBULIN"	0.47972972972973	0.768491313234543	0.0725351864394589	0.447390713771169	1.01568826164217	8	"Tuba1c, Tubb6, Ttll7, Tuba1b, Tubb4b"
"REACTOME_CARDIAC_CONDUCTION"	0.869565217391304	0.977270927377841	0.0609039347452418	-0.277030494908817	-0.659340533696251	7	"Scn1b, Itpr1, Atp2b4, Akap9, Slc8a1"
"REACTOME_CARGO_RECOGNITION_FOR_CLATHRIN_MEDIATED_ENDOCYTOSIS"	0.442379182156134	0.73570877463702	0.0817515582532145	0.563253961788929	1.03510848331186	4	"Tgfa, Cltb, Tfrc"
"REACTOME_CARGO_TRAFFICKING_TO_THE_PERICILIARY_MEMBRANE"	0.240425531914894	0.619839263724156	0.128142916898415	-0.67608504619431	-1.23243810812217	3	"Bbs10, Inpp5e"
"REACTOME_CASPASE_ACTIVATION_VIA_EXTRINSIC_APOPTOTIC_SIGNALLING_PATHWAY"	0.87593984962406	0.979382193951256	0.0488970772260102	0.389529302597457	0.660695189291632	3	"Fas"
"REACTOME_CDC42_GTPASE_CYCLE"	0.913946587537092	0.992036176359754	0.0684714904492087	-0.196319018404908	-0.682863865339981	22	"Srgap1, Dock6, Baiap2, Vav2, Arhgef5, Prex1, Dock8, Mcf2l, Plekhg3, Fam13b, Arhgap27, Bcr, Arhgdia, Gna13, Stard8, Tmpo, Cdc42ep3, Tfrc, Lbr, Diaph3, Racgap1, Ect2"
"REACTOME_CELLULAR_RESPONSES_TO_EXTERNAL_STIMULI"	0.0478036175710594	0.29551409577668	0.234392647294686	0.40667389951636	1.46355749567634	60	"H3c8, H1f1, H2bc11, Cdkn1a, H3c3, Tuba1c, H3c1, Ar, H2ac4, Tubb6, H4c14, Asns, Hmga1, Txn1, Tuba1b, Ccna2, Nup205, H3c7, Hspa9, H4c4, Cdk6, Hspa1a, H1f3, Tubb4b, H3c6, Hsp90aa1, Psmd2, H2bc6, Psmd14"
"REACTOME_CELLULAR_RESPONSE_TO_CHEMICAL_STRESS"	0.899761336515513	0.986735266229517	0.0587185879555941	-0.236875719458808	-0.628754215475038	9	"Nox4"
"REACTOME_CELLULAR_RESPONSE_TO_HEAT_STRESS"	0.334488734835355	0.67006347205654	0.0934449219410994	0.539110550674968	1.12708427944664	6	"Nup205, Hspa9, Hspa1a, Hsp90aa1, Vcp"
"REACTOME_CELLULAR_RESPONSE_TO_HYPOXIA"	0.872665534804754	0.97897206359006	0.0444181153081573	0.298815495528545	0.656767686633917	7	"Psmd2, Psmd14, Psmd11, Psmc3, Epas1"
"REACTOME_CELLULAR_RESPONSE_TO_STARVATION"	0.675417661097852	0.86626305623122	0.0727141077934447	-0.31099389994467	-0.825490793332396	9	"Rpl23, Bmt2, Wdr59, Rpl31, Rps27, Rps7, Gcn1"
"REACTOME_CELLULAR_SENESCENCE"	0.00346513263213314	0.110684165045593	0.431707695803346	0.609954843194334	1.78941036238503	24	"H3c8, H1f1, H2bc11, Cdkn1a, H3c3, H3c1, H2ac4, H4c14, Hmga1, Txn1, Ccna2, H3c7, H4c4, Cdk6, H1f3, H3c6, H2bc6"
"REACTOME_CELL_CELL_COMMUNICATION"	0.546551724137931	0.782176691278502	0.0670512579829467	0.395156389718003	0.937125294000106	10	"Fyb, Itga6"
"REACTOME_CELL_CYCLE"	1.04563555652721e-09	6.45157138377291e-07	0.788186810800237	0.608938186634698	2.32317170737753	93	"H3c8, Chmp4c, Ercc6l, Nuf2, Ccnd1, Clspn, Rrm2, H2bc11, Cdkn1a, Prim2, Kif18a, H3c3, Mcm5, Pola1, Tuba1c, Kntc1, Mcm2, Gtse1, H3c1, Brca1, Tpx2, Haus6, H2ac4, Ncapg2, Tubb6, Knl1, H4c14, Foxm1, Lig1, Tuba1b, Kif23, Mcm4, Ccna2, Mcm3, Smc2, Ccnd2, Plk4, Nup205, Kif2c, Hmmr, Mad2l1, Ncaph, H3c7, Orc6, Ran, Mis18bp1, H4c4, Mcm6, Cdk6, Pole, Top2a, Tubb4b, H3c6, Hsp90aa1, Rangap1, Psmd2, Rfc1, Rnf168, H2bc6, Psmd14, Lbr, Chek1, Set, Rbl1, Tfdp1, Kpnb1, Psmd11, Lmnb1, Pole4, Dbf4, Tmpo, Kif20a, Tubb2a, Psmc3"
"REACTOME_CELL_CYCLE_CHECKPOINTS"	0.000393233348998964	0.0202187480276967	0.49849310876659	0.597412725026501	1.96049348304598	39	"Ercc6l, Nuf2, Clspn, H2bc11, Cdkn1a, Kif18a, Mcm5, Kntc1, Mcm2, Gtse1, Brca1, Knl1, H4c14, Mcm4, Ccna2, Mcm3, Kif2c, Mad2l1, Orc6, H4c4, Mcm6, Rangap1, Psmd2, Rnf168, H2bc6, Psmd14"
"REACTOME_CELL_CYCLE_MITOTIC"	5.27471956333956e-09	1.62725098529025e-06	0.761460801445585	0.611146606208519	2.30526186117088	85	"H3c8, Chmp4c, Ercc6l, Nuf2, Ccnd1, Rrm2, H2bc11, Cdkn1a, Prim2, Kif18a, H3c3, Mcm5, Pola1, Tuba1c, Kntc1, Mcm2, Gtse1, H3c1, Tpx2, Haus6, H2ac4, Ncapg2, Tubb6, Knl1, H4c14, Foxm1, Lig1, Tuba1b, Kif23, Mcm4, Ccna2, Mcm3, Smc2, Ccnd2, Plk4, Nup205, Kif2c, Hmmr, Mad2l1, Ncaph, H3c7, Orc6, Ran, H4c4, Mcm6, Cdk6, Pole, Top2a, Tubb4b, H3c6, Hsp90aa1, Rangap1, Psmd2, Rfc1, H2bc6, Psmd14, Lbr, Set, Rbl1, Tfdp1, Kpnb1, Psmd11, Lmnb1, Pole4, Dbf4, Tmpo, Kif20a, Tubb2a, Psmc3"
"REACTOME_CELL_DEATH_SIGNALLING_VIA_NRAGE_NRIF_AND_NADE"	0.809756097560976	0.945325578096184	0.0647943366000727	-0.292070740217777	-0.729806981087452	8	"Bcl2l11, Vav2, Arhgef5, Prex1, Mcf2l"
"REACTOME_CELL_EXTRACELLULAR_MATRIX_INTERACTIONS"	0.0463834707707871	0.29460969829873	0.321775918075361	-0.809508968163215	-1.47565710386127	3	"Flnc, Fblim1"
"REACTOME_CELL_JUNCTION_ORGANIZATION"	0.0141141020359476	0.15550715993178	0.380730400722792	-0.710141136105735	-1.69015629789684	7	"Flnc, Itgb4, Fblim1, Nectin3"
"REACTOME_CELL_SURFACE_INTERACTIONS_AT_THE_VASCULAR_WALL"	0.0521008403361345	0.304432965846889	0.257206466468838	0.63798072035684	1.55313550137292	11	"Pf4, L1cam, Mertk"
"REACTOME_CHEMOKINE_RECEPTORS_BIND_CHEMOKINES"	0.0467937608318891	0.29460969829873	0.276500599254472	0.730830363633922	1.52790074830251	6	"Pf4, Cxcl10, Ccrl2, Cxcl12"
"REACTOME_CHONDROITIN_SULFATE_DERMATAN_SULFATE_METABOLISM"	0.342672413793103	0.670786366971253	0.105125131597001	-0.578831901042603	-1.15082542057721	4	"Gpc4, Xylt2"
"REACTOME_CHROMATIN_MODIFYING_ENZYMES"	0.253256150506512	0.619839263724156	0.0992333343771191	0.393849800947727	1.1933059395316	27	"H3c8, Ccnd1, H2bc11, H3c3, H3c1, H2ac4, H4c14, Hat1, H3c7, H4c4, H3c6, H2bc6, Suv39h1"
"REACTOME_CHROMOSOME_MAINTENANCE"	0.0151457771737076	0.161119733037545	0.380730400722792	0.632068230798321	1.73247803675437	17	"H2bc11, Prim2, Pola1, H2ac4, Knl1, H4c14, Lig1, Ccna2, Mis18bp1, H4c4, Rfc1, H2bc6"
"REACTOME_CILIUM_ASSEMBLY"	0.624605678233438	0.836553454003118	0.0564118388217596	0.32406298889844	0.870872008085462	16	"Tuba1c, Haus6, Tubb6, Tuba1b, Plk4, Tubb4b, Hsp90aa1, Tubb2a, Pcnt, Tubb5, Tuba1a, Exoc4"
"REACTOME_CIRCADIAN_CLOCK"	0.116331096196868	0.46916187901318	0.195789002148949	-0.662311557788945	-1.4247757579411	5	"Npas2, Hif1a, Serpine1, Sik1, Tbl1xr1"
"REACTOME_CLASS_A_1_RHODOPSIN_LIKE_RECEPTORS"	0.170926517571885	0.577118101708266	0.132147260608774	0.496804226574443	1.29667069601079	14	"Pf4, Apln, Cxcl10, Ccrl2, Cxcl12"
"REACTOME_CLASS_I_MHC_MEDIATED_ANTIGEN_PROCESSING_PRESENTATION"	0.948377581120944	0.99830220713073	0.0340463727579649	0.195950973293159	0.581131867549739	25	"H2-Q7, Hecw2, Sh3rf1, Psmd2, Psmd14, Tapbp, Tap1, Psmd11, Cd36, Ube2l3, Psmc3, B2m, Asb8, Cdc20, Canx"
"REACTOME_CLATHRIN_MEDIATED_ENDOCYTOSIS"	0.971283783783784	0.99830220713073	0.0392758570896778	0.218258570743407	0.49550127323443	8	"Tgfa, Cltb, Tfrc, Actr3"
"REACTOME_CLEC7A_DECTIN_1_INDUCES_NFAT_ACTIVATION"	0.98936170212766	0.99830220713073	0.0489954089862481	-0.276460257839687	-0.50396049884675	3	"Itpr1, Nfatc1"
"REACTOME_CLEC7A_DECTIN_1_SIGNALING"	0.607809847198642	0.831526997165326	0.0611692626746689	0.391819841029492	0.861182282783008	7	"Psmd2, Psmd14, Itpr3, Psmd11, Psmc3"
"REACTOME_COLLAGEN_BIOSYNTHESIS_AND_MODIFYING_ENZYMES"	0.000843712320829034	0.0347047001301009	0.477270815362862	-0.771484395491518	-2.04779986292709	9	"Adamts2, Col28a1, Col15a1, Bmp1"
"REACTOME_COLLAGEN_CHAIN_TRIMERIZATION"	0.0296202271072297	0.239846681789683	0.352487857583619	-0.751984403292444	-1.61768149077401	5	"Col28a1, Col15a1"
"REACTOME_COLLAGEN_DEGRADATION"	0.051174251789366	0.304432965846889	0.321775918075361	-0.679494203478768	-1.5427976835107	6	"Mmp11, Col15a1"
"REACTOME_COLLAGEN_FORMATION"	0.000726240426711706	0.0320064530915088	0.477270815362862	-0.694031874502582	-2.0280337246658	13	"Adamts2, Col28a1, Col15a1, Itgb4, Bmp1"
"REACTOME_COMMON_PATHWAY_OF_FIBRIN_CLOT_FORMATION"	0.0069182659485831	0.110684165045593	0.407017918923954	0.903102427081315	1.65965807076152	4	"Pf4, F13a1"
"REACTOME_CONDENSATION_OF_PROPHASE_CHROMOSOMES"	0.0064701753995021	0.110684165045593	0.407017918923954	0.667257022937659	1.75863129613929	15	"H3c8, H2bc11, H3c3, H3c1, H2ac4, Ncapg2, H4c14, Smc2, H3c7, H4c4, H3c6, H2bc6"
"REACTOME_CONSTITUTIVE_SIGNALING_BY_ABERRANT_PI3K_IN_CANCER"	0.0702702702702703	0.361306306306306	0.227987202850442	0.734251446191308	1.44156096241983	5	"Pik3ap1, Tgfa, Kitl"
"REACTOME_COOPERATION_OF_PREFOLDIN_AND_TRIC_CCT_IN_ACTIN_AND_TUBULIN_FOLDING"	0.24263431542461	0.619839263724156	0.11331290842208	0.596579476861167	1.24723092317314	6	"Tuba1c, Tubb6, Tuba1b, Tubb4b, Tubb2a, Tuba1a"
"REACTOME_COPI_DEPENDENT_GOLGI_TO_ER_RETROGRADE_TRAFFIC"	0.0318569624033833	0.25199674106266	0.321775918075361	0.577586748101576	1.60970019225379	18	"Kif18a, Kif11, Tuba1c, Tubb6, Kif15, Tuba1b, Kif23, Kif4, Kif2c, Racgap1, Tubb4b, Kif20b, Kif20a, Tubb2a, Arf1, Tuba1a"
"REACTOME_COPI_INDEPENDENT_GOLGI_TO_ER_RETROGRADE_TRAFFIC"	0.178268251273345	0.588481291269259	0.133554954557592	0.591137965760322	1.29926432887012	7	"Tuba1c, Tubb6, Tuba1b, Tubb4b, Tubb2a, Tuba1a, Rab6a"
"REACTOME_COPI_MEDIATED_ANTEROGRADE_TRANSPORT"	0.375643224699828	0.677907621135822	0.0862865626267245	0.467195653265241	1.07774672029835	9	"Tuba1c, Tubb6, Tuba1b, Tubb4b, Tubb2a, Arf1, Tuba1a"
"REACTOME_COSTIMULATION_BY_THE_CD28_FAMILY"	0.0118695320820421	0.143598064600391	0.380730400722792	0.835994688619879	1.64131417671153	5	"H2-Eb1, Cd274"
"REACTOME_CRISTAE_FORMATION"	0.385338345864662	0.681242863606006	0.0899860794997137	0.639919759277834	1.08539178867486	3	"Hspa9, Atp5g1, Atp5b"
"REACTOME_CROSSLINKING_OF_COLLAGEN_FIBRILS"	0.258620689655172	0.619839263724156	0.12384217120105	-0.622489959839357	-1.23762575723084	4	"Bmp1, Col4a2, Col4a1, Pxdn"
"REACTOME_CROSS_PRESENTATION_OF_SOLUBLE_EXOGENOUS_ANTIGENS_ENDOSOMES"	0.237837837837838	0.619839263724156	0.117249716749792	0.625666537928866	1.22837545809289	5	"Psmd2, Psmd14, Psmd11, Psmc3, Mrc1"
"REACTOME_CYCLIN_A_B1_B2_ASSOCIATED_EVENTS_DURING_G2_M_TRANSITION"	0.340225563909774	0.670786366971253	0.0972150808846466	0.663008287131139	1.12455310254466	3	"Foxm1, Ccna2, Xpo1"
"REACTOME_CYCLIN_A_CDK2_ASSOCIATED_EVENTS_AT_S_PHASE_ENTRY"	0.0844594594594595	0.413583226083226	0.199915231309662	0.64616935483871	1.46696524657474	8	"Ccnd1, Cdkn1a, Ccna2, Psmd2, Psmd14, Tfdp1, Psmd11, Psmc3"
"REACTOME_CYCLIN_D_ASSOCIATED_EVENTS_IN_G1"	0.0762564991334489	0.381125600549073	0.213927855492356	0.69215291750503	1.44704026162415	6	"Ccnd1, Cdkn1a, Ccnd2, Cdk6, Rbl1, Tfdp1"
"REACTOME_CYTOCHROME_P450_ARRANGED_BY_SUBSTRATE_TYPE"	0.765037593984962	0.929189361198271	0.0551351763385257	0.457372116349047	0.77576591792435	3	"Cyp4b1, Cyp4v3, Cyp1b1"
"REACTOME_CYTOKINE_SIGNALING_IN_IMMUNE_SYSTEM"	0.00699624381973762	0.110684165045593	0.407017918923954	0.458639350423245	1.67725228939284	70	"Blnk, Csf3r, H2-Eb1, F13a1, H3c8, Eda2r, Ccnd1, Cdkn1a, Cxcl10, H3c3, Ifit2, H3c1, Taldo1, Tnf, Gbp5, Rsad2, H2-Q7, Nup205, H3c7, Hspa9, Nos2, Ifit3, H3c6, Hsp90aa1, Sqstm1, Psmd2, Psmd14, Oas2, Il18bp, Dusp3, Csf1, Kpna2, Kpnb1, Psmd11, Msn, Lmnb1, Cd36"
"REACTOME_CYTOPROTECTION_BY_HMOX1"	0.884550084889643	0.983838768345811	0.0438002031299891	0.293306068335188	0.644658496158173	7	"Psmd2, Psmd14, Psmd11, Psmc3"
"REACTOME_CYTOSOLIC_TRNA_AMINOACYLATION"	0.28996282527881	0.634422209918532	0.106323255932708	0.635968359997467	1.16873788594494	4	"Wars, Ppa1, Rars, Mars1"
"REACTOME_C_TYPE_LECTIN_RECEPTORS_CLRS"	0.641891891891892	0.842644745076708	0.0583452776743612	0.372464651629556	0.845587453856444	8	"Psmd2, Psmd14, Itpr3, Psmd11, Psmc3"
"REACTOME_DAG_AND_IP3_SIGNALING"	0.967672413793103	0.99830220713073	0.0506004243853618	-0.273092369477912	-0.542958396720628	4	"Itpr1, Plcg1, Kpna2, Itpr3"
"REACTOME_DAP12_INTERACTIONS"	0.970917225950783	0.99830220713073	0.0521630305460055	-0.242282130825158	-0.521201393094217	5	"Lcp2, Vav2"
"REACTOME_DAP12_SIGNALING"	0.588362068965517	0.819463592245267	0.0745500777420554	-0.44292329393625	-0.880613845072288	4	"Lcp2, Vav2, Plcg1"
"REACTOME_DARPP_32_EVENTS"	0.81063829787234	0.945325578096184	0.0582216241124161	-0.390170511534604	-0.711243370619628	3	"Pde4d, Pde4b, Ppp2r5d"
"REACTOME_DDX58_IFIH1_MEDIATED_INDUCTION_OF_INTERFERON_ALPHA_BETA"	0.343984962406015	0.670786366971253	0.0965629554309422	0.66098294884654	1.12111785068453	3	"Nlrc5, Hsp90aa1, Ifih1"
"REACTOME_DEACTIVATION_OF_THE_BETA_CATENIN_TRANSACTIVATING_COMPLEX"	0.331096196868009	0.667602462312293	0.109684061970549	-0.534164020882827	-1.14910262212383	5	"Tle3, Chd8, Sox4, Tcf7l2"
"REACTOME_DEATH_RECEPTOR_SIGNALLING"	0.87620578778135	0.979382193951256	0.0417397034728504	0.255188739369354	0.650775545712584	13	"Fas, Tnf, Ect2, Sqstm1, Rtn4, Gna13, Arhgdia"
"REACTOME_DECTIN_1_MEDIATED_NONCANONICAL_NF_KB_SIGNALING"	0.278810408921933	0.619839263724156	0.108820126769161	0.643574297188755	1.18271554193024	4	"Psmd2, Psmd14, Psmd11, Psmc3"
"REACTOME_DEFECTIVE_CFTR_CAUSES_CYSTIC_FIBROSIS"	0.252252252252252	0.619839263724156	0.11331290842208	0.619095477386935	1.21547444930621	5	"Psmd2, Psmd14, Psmd11, Psmc3, Vcp"
"REACTOME_DEGRADATION_OF_AXIN"	0.278810408921933	0.619839263724156	0.108820126769161	0.643574297188755	1.18271554193024	4	"Psmd2, Psmd14, Psmd11, Psmc3"
"REACTOME_DEGRADATION_OF_BETA_CATENIN_BY_THE_DESTRUCTION_COMPLEX"	0.755517826825127	0.924909720537904	0.051011413203915	0.342624507539436	0.753055676723647	7	"Psmd2, Psmd14, Psmd11, Psmc3, Ppp2r5d"
"REACTOME_DEGRADATION_OF_DVL"	0.278810408921933	0.619839263724156	0.108820126769161	0.643574297188755	1.18271554193024	4	"Psmd2, Psmd14, Psmd11, Psmc3"
"REACTOME_DEGRADATION_OF_GLI1_BY_THE_PROTEASOME"	0.278810408921933	0.619839263724156	0.108820126769161	0.643574297188755	1.18271554193024	4	"Psmd2, Psmd14, Psmd11, Psmc3"
"REACTOME_DEGRADATION_OF_THE_EXTRACELLULAR_MATRIX"	8.40060198399092e-06	0.0006478964280153	0.593325476396405	-0.763047291225431	-2.35785009562328	15	"Adamts18, Eln, Mmp11, Htra1, Timp2, Col15a1, Bmp1"
"REACTOME_DEPOSITION_OF_NEW_CENPA_CONTAINING_NUCLEOSOMES_AT_THE_CENTROMERE"	0.0603448275862069	0.326603145795523	0.241339976815091	0.642001070443347	1.52252489784349	10	"H2bc11, H2ac4, Knl1, H4c14, Mis18bp1, H4c4, H2bc6"
"REACTOME_DEREGULATED_CDK5_TRIGGERS_MULTIPLE_NEURODEGENERATIVE_PATHWAYS_IN_ALZHEIMER_S_DISEASE_MODELS"	0.953191489361702	0.99830220713073	0.0507027937029348	-0.321965897693079	-0.58691290994576	3	"Bcl2l11, Capn2, Lmnb1"
"REACTOME_DEUBIQUITINATION"	0.213533834586466	0.619670484707908	0.112378519110475	0.438548845411655	1.25740529096725	21	"Clspn, H2bc11, Brca1, Ar, H2ac4, Ccna2, Psmd2, H2bc6, Psmd14, Psmd11, Ifih1, Psmc3, Uchl5, Vcp"
"REACTOME_DEVELOPMENTAL_BIOLOGY"	0.263922518159806	0.619839263724156	0.0865399737444125	0.301633410354107	1.15072584025253	94	"Csf3r, Robo2, H3c8, St8sia2, Lpl, H2bc11, Cdkn1a, H3c3, Adam22, Tuba1c, L1cam, H3c1, Tnf, H2ac4, Tubb6, H4c14, Tuba1b, Cxcl12, Kif4, Ntn1, H3c7, Dek, H4c4, Tubb4b, H3c6, Hsp90aa1, Cltb, Psmd2, Cap1, H2bc6, Psmd14"
"REACTOME_DISEASES_ASSOCIATED_WITH_O_GLYCOSYLATION_OF_PROTEINS"	9.2948383500818e-07	0.000143372881550012	0.659444398037935	-0.878037838245971	-2.42114298029791	10	"Adamts17, Adamts18, Adamts2, Adamts12, Thbs1, Adamts10, Lfng, Thsd7a"
"REACTOME_DISEASES_OF_GLYCOSYLATION"	1.73820457476072e-06	0.000214494444525473	0.643551836150722	-0.81485732633734	-2.38109833181298	13	"Adamts17, Adamts18, Adamts2, Adamts12, Thbs1, Adamts10, Lfng, Thsd7a, Gpc4"
"REACTOME_DISEASES_OF_METABOLISM"	2.54050604057093e-05	0.00174165803003585	0.575610261071129	-0.745979350223467	-2.3051093981772	15	"Adamts17, Adamts18, Adamts2, Adamts12, Thbs1, Adamts10, Lfng, Thsd7a, Gpc4"
"REACTOME_DISEASES_OF_MITOTIC_CELL_CYCLE"	0.209705372616984	0.616134356688949	0.123257226381337	0.606704645519787	1.26839897192972	6	"Ccnd1, Cdkn1a, Ccnd2, Cdk6, Tfdp1"
"REACTOME_DISEASES_OF_PROGRAMMED_CELL_DEATH"	0.0107228688972375	0.135020614481542	0.380730400722792	0.622361121604659	1.73448372974464	18	"H3c8, H2bc11, Prim2, H3c3, Pola1, H3c1, H2ac4, H4c14, Dnmt1, H3c7, H4c4, H3c6, H2bc6"
"REACTOME_DISEASES_OF_SIGNAL_TRANSDUCTION_BY_GROWTH_FACTOR_RECEPTORS_AND_SECOND_MESSENGERS"	0.643250688705234	0.842644745076708	0.0487989701682839	0.26894586141044	0.875729072823944	37	"Pik3ap1, Bin2, Cdkn1a, Tgfa, Hdac9, Kitl"
